{
  "schema": "deeplus.formatter-lsp-incremental-parsing-contract/r1",
  "status": "STABLE_DESIGN_IMPLEMENTATION_READINESS_CANDIDATE",
  "candidate_class": "LOCAL_NONCANONICAL_NONACTIVATABLE",
  "baseline": {
    "repository": "howork/Deeplus",
    "branch": "main",
    "commit": "39a5d50cc770341c4b9776d00d84520b780d0c62",
    "tree": "b19b2a86c0f29c1f73763c8526a3a7bde23d530a"
  },
  "gap_id": "IR-FE-P1-037",
  "dependencies": [
    "IR-FE-P0-028",
    "IR-FE-P1-034"
  ],
  "inputs": {
    "parser_authority": "spec/contracts/parser-authority-traceability-r1.json",
    "structural_grammar": "spec/grammar/deeplus.dpg",
    "parser_contexts": "spec/grammar/deeplus.parser-contexts.json",
    "pratt_contract": "spec/contracts/closed-pratt-parse-goal-contract-r1.json",
    "surface_census": "spec/grammar/deeplus.ebnf",
    "grammar_disposition_registry": "spec/contracts/grammar-production-disposition-registry-r1.json",
    "grammar_topology": "spec/contracts/grammar-topology-closure-r1.json",
    "frontend_model": "spec/frontend/frontend-model.json",
    "recovery_contract": "spec/contracts/frontend-recovery-invalid-tree-contract-r1.json",
    "parser_boundary_contract": "spec/contracts/parser-boundary-match-arm-contract-r1.json",
    "scanner_contract": "spec/contracts/complete-token-lexical-goal-contract-r1.json"
  },
  "parser_authority_rebase": {
    "gap_id": "IR-FE-P1-063",
    "baseline_main": "10e64f492f0529610673846139afcf0d95175663",
    "decision": "decisions/language/Design_Deeplus_Formatter_LSP_DPG_Authority_Rebase_R1.md",
    "authority_contract": {
      "path": "spec/contracts/parser-authority-traceability-r1.json",
      "sha256": "9f8b60146298a930f7fe3f63408a8e89c8ac57e540595902e954d66852792133"
    },
    "authority_digest_set": [
      {
        "axis": "STRUCTURAL_DPG",
        "path": "spec/grammar/deeplus.dpg",
        "sha256": "b2082354f28bccabe919867e9413cc99ecf664ae4f045c5abba79f24fa92d8c7"
      },
      {
        "axis": "PARSER_CONTEXT",
        "path": "spec/grammar/deeplus.parser-contexts.json",
        "sha256": "c6dc864277f5b02b7a89cc508f55bac23d27f14ee3ed1259052dd2e74b5144a7"
      },
      {
        "axis": "PRATT",
        "path": "spec/contracts/closed-pratt-parse-goal-contract-r1.json",
        "sha256": "e4813270f2a79d6e144c2feade3f035af6f5b2cde3b529662d2d1713b1c9462a"
      },
      {
        "axis": "SCANNER",
        "path": "spec/contracts/complete-token-lexical-goal-contract-r1.json",
        "sha256": "72bfe6d713f17d0789d064b062c62447961dad0c0ac80335da5f7be67293896a"
      }
    ],
    "snapshot_component": "ParserAuthorityDigestSetR1",
    "surface_census": {
      "path": "spec/grammar/deeplus.ebnf",
      "sha256": "42780c57b387aa1f369cf28591f1007a8819c73da1715d73cf60f434282dabda",
      "semantic_authority": false,
      "role": "FORMATTER_CST_AST_DISPOSITION_CROSSWALK_ONLY"
    },
    "full_parse_reference": "SCANNER_PLUS_DPG_PLUS_PARSER_CONTEXT_PLUS_PRATT_PLUS_LOSSLESS_CST_RECOVERY_PLUS_AST_CHECKER",
    "ebnf_only_admission_count": 0,
    "incremental_source_language_widening_count": 0,
    "tooling_parser_semantic_reselection_count": 0
  },
  "responsibility_separation": {
    "formatter": "selects only declared layout actions over an admitted lossless CST and proves parse-format-parse AST equivalence plus idempotence",
    "incremental_parser": "selects, reparses, and conditionally splices one deterministic CST owner without changing language admission",
    "lsp": "binds every request and result to one document revision, source role/profile, parse snapshot, and contract digest set",
    "checker": "never repairs CST structure or clears recovery taint",
    "canonical_ast_hir": "consume only recovery-free sealed output; incremental and tooling handles are excluded from canonical identity",
    "runtime_backend": "no formatter, LSP, reparse, or tooling identity survives into MIR, xVM, Cranelift, ABI, or runtime state"
  },
  "formatting_disposition_function": {
    "input_domain": "exact 656 rows of grammar-production-disposition-registry-r1 after the R77 atomic surface cutover",
    "ordered_first_match": true,
    "total_and_disjoint": true,
    "rules": [
      {
        "rule_id": "FD-01",
        "when": {
          "profile": "LEXICAL",
          "cst_shape": "TOKEN_OR_TRIVIA_LEAF",
          "disposition": "cst_only"
        },
        "formatting_disposition": "PRESERVE_TOKEN_OR_TRIVIA_BYTES",
        "expected_row_count": 54
      },
      {
        "rule_id": "FD-02",
        "when": {
          "profile": "LEXICAL",
          "cst_shape": "INLINE_IN_PARENT_PRODUCTION_NODE",
          "disposition": "cst_only"
        },
        "formatting_disposition": "DELEGATE_TO_SCANNER_TOKEN_OWNER",
        "expected_row_count": 33
      },
      {
        "rule_id": "FD-03",
        "when": {
          "profile_not": "LEXICAL",
          "cst_shape": "INLINE_IN_PARENT_PRODUCTION_NODE",
          "disposition": "cst_only"
        },
        "formatting_disposition": "PRESERVE_INLINE_CST_BYTES_UNLESS_PARENT_RULE",
        "expected_row_count": 333
      },
      {
        "rule_id": "FD-04",
        "when": {
          "cst_shape": "PRODUCTION_NODE",
          "disposition": "ast_node"
        },
        "formatting_disposition": "PRESERVE_STRUCTURAL_SOURCE_UNLESS_EXPLICIT_OWNER_RULE",
        "expected_row_count": 205
      },
      {
        "rule_id": "FD-05",
        "when": {
          "cst_shape": "PRODUCTION_NODE",
          "disposition": "normalize_to"
        },
        "formatting_disposition": "FORMAT_CANONICAL_NORMALIZATION_TARGET",
        "expected_row_count": 12
      },
      {
        "rule_id": "FD-06",
        "when": {
          "cst_shape": "DISPATCH_ENTRY_NO_NODE",
          "disposition": "external_parser_entry"
        },
        "formatting_disposition": "DELEGATE_TO_SELECTED_EXTERNAL_ENTRY_OWNER",
        "expected_row_count": 19
      }
    ],
    "expected_total_row_count": 656,
    "unclassified_row_count": 0,
    "multiply_classified_row_count": 0,
    "default_rewrite": "PRESERVE_EXACT_SOURCE_BYTES",
    "undeclared_style_preference_count": 0
  },
  "explicit_owner_rule_gate": {
    "admission": [
      "the rule has one canonical owner path and field",
      "the selected source profile admits the owner",
      "the rule changes layout or a declared equivalent spelling only",
      "comments and trivia retain one lossless owner",
      "parse-format-parse normalized AST identity is equal",
      "a second formatting pass emits zero edits"
    ],
    "current_owner_paths": [
      "spec/frontend/frontend-model.json#/boundary_policies/hash_role_trivia",
      "spec/frontend/frontend-model.json#/call_frontend_contract/formatter",
      "spec/frontend/frontend-model.json#/function_static_activation_frontend_contract",
      "spec/frontend/frontend-model.json#/callable_responsibility_clause_contract",
      "spec/frontend/frontend-model.json#/borrow_context_anchor_frontend_contract/formatter_round_trip"
    ],
    "missing_or_ambiguous_owner_rule": "PRESERVE_EXACT_SOURCE_BYTES",
    "composition_law": "token spellings and comments retain exact byte ownership; only whitespace or layout slots named by one unique parent owner rule may change",
    "line_break_boundary_preservation": "a LineBreakBoundary or comment-owned newline remains when removing or moving it could change parsing",
    "actor_protocol_token_rewrite_count": 0,
    "actor_protocol_required_spellings": [
      "conforms",
      "conform",
      "QualifiedTypeReference",
      "on",
      "request"
    ],
    "semantic_auto_rewrite_count": 0,
    "profile_activation_count": 0
  },
  "recovery_and_malformed_cst": {
    "whole_file_format": "REQUIRE_EMPTY_RECOVERY_TAINT",
    "range_format": "REQUIRE_ONE_SMALLEST_RECOVERY_FREE_FORMAT_OWNER_WHOLELY_CONTAINING_RANGE",
    "formatter_may_clear_taint": false,
    "checker_may_clear_taint": false,
    "taint_clear_owner": "NEW_PARSE_OF_CHANGED_INPUT_ONLY",
    "recovery_nodes_rewritten_or_removed_by_formatter": false,
    "analysis_only_fragments_advertised_as_canonical": false,
    "fixit_scope": "exact action admitted by recovery contract; never invent semantic source"
  },
  "identity_domains": {
    "DocumentSessionId": {
      "domain": "editor process local",
      "canonical_residue": false
    },
    "DocumentRevisionId": {
      "recipe": [
        "DocumentSessionId",
        "strictly_monotonic_revision_ordinal"
      ],
      "canonical_residue": false
    },
    "ParseSnapshotId": {
      "recipe": [
        "SourceFileId",
        "DocumentRevisionId",
        "source_bytes_sha256",
        "source_role",
        "activation_profile",
        "parser_authority_digest_set",
        "frontend_contract_digest_set"
      ],
      "owns": [
        "immutable CST occurrence tree",
        "line map and negotiated position encoding",
        "ordered diagnostic set",
        "recovery episode set"
      ],
      "canonical_residue": false
    },
    "CstContentId": {
      "recipe": [
        "structural_cst_owner_id",
        "profile",
        "ordered child CstContentId or exact token kind and bytes",
        "lossless trivia ownership"
      ],
      "position_independent": true,
      "canonical_residue": false
    },
    "CstOccurrenceId": {
      "recipe": [
        "ParseSnapshotId",
        "CstNodeId"
      ],
      "current_cst_node_id_mapping": "CstOccurrenceId = snapshot-qualified occurrence of current CstNodeId(SourceFileId, green_path, CstKind, byte_range)",
      "cross_revision_stability": false,
      "snapshot_local": true,
      "canonical_residue": false
    },
    "IncrementalNodeHandleId": {
      "recipe": [
        "DocumentSessionId",
        "monotonic handle generation"
      ],
      "reuse": "preserved only by one accepted one-to-one NodeReuseReceipt",
      "canonical_residue": false
    },
    "NodeReuseReceipt": {
      "old_to_new_cardinality": "ONE_TO_ONE_ONLY",